{
  "version": 1,
  "status": "ready",
  "goal": "把《七点零五分》的六行诗做成 66 秒静默短片：一间清晨的咖啡馆，晨光当唯一的钟表，每行字幕对应画面里真实发生的一件事。",
  "audience": "愿意安静看完一分钟的普通观众",
  "format": {
    "durationSec": 66,
    "fps": 30,
    "width": 1920,
    "height": 1080
  },
  "content": {
    "facts": [],
    "beats": [
      {
        "order": 1,
        "timeLock": "soft",
        "target": "片头到第一句",
        "what": "七点，卷帘门只拉起一半，晨光先落进吧台。",
        "visual": "半开的卷帘门把街上的光切成一条横带；光落在空吧台和地面上，尘埃在里面慢慢漂；店里还没有人。",
        "mustAchieve": "观众一眼知道店还没开门，但光已经先进来了。",
        "mayUse": ["卷帘门缝里的街道", "光里的尘埃", "吧台木纹上的亮边"],
        "avoid": ["大字标题卡", "纯黑背景加光球", "与店无关的空镜"]
      },
      {
        "order": 2,
        "timeLock": "soft",
        "target": "第二句",
        "what": "磨豆机响了一声，像把整条街的安静磨碎。",
        "visual": "吧台上的磨豆机亮着金属边；它短促地震一下，豆子跳、粉落进小杯，灯罩和墙上的光带跟着轻轻晃，然后比之前更静。",
        "mustAchieve": "观众能感到这一声很短，短到把安静衬得更明显。",
        "mayUse": ["磨豆机上的金属反光", "落粉的细尘", "灯罩的轻摆"],
        "avoid": ["爆炸式粒子", "持续轰鸣的机器", "把磨豆机做成抽象光效"]
      },
      {
        "order": 3,
        "timeLock": "soft",
        "target": "第三句",
        "what": "热水穿过咖啡粉，杯壁一点点变深。",
        "visual": "细口壶倾斜，一条细水柱落进滤杯；粉层鼓起来，玻璃壶里的咖啡从琥珀色一点点变深、变高，蒸汽在晨光里往上走。",
        "mustAchieve": "观众看见水真的穿过粉，咖啡的颜色真的在变深。",
        "mayUse": ["滤杯里的气泡", "玻璃壶上的高光", "水柱的细响感"],
        "avoid": ["只拍热气不拍水", "用色块代替液体", "夸张的沸腾"]
      },
      {
        "order": 4,
        "timeLock": "soft",
        "target": "第四句",
        "what": "牛奶落下去，白色在褐色里卷成一朵花。",
        "visual": "杯口占满画面，褐色表面上一圈细密的油脂；白色奶流落下去，叶片状的纹样从后向前一层层展开，最后拉出一条细茎。",
        "mustAchieve": "观众看清白色在褐色里卷成花，而不是只看到一杯做好的咖啡。",
        "mayUse": ["杯口的热气", "奶流的高光", "杯沿的一点光"],
        "avoid": ["用贴图直接放一个拉花图案", "跳过倒奶过程", "俯拍成钟表盘"]
      },
      {
        "order": 5,
        "timeLock": "soft",
        "target": "第五句",
        "what": "七点零五分，门被推开，风把光推到杯沿。",
        "visual": "墙上的钟走到七点零五分；玻璃门向内开，门铃晃，门外的亮光和一阵风一起进来，把地上一块光推到吧台那端的杯沿，杯沿亮了一下。",
        "mustAchieve": "观众知道时间到了七点零五分，门开了，光和风是同时进来的。",
        "mayUse": ["门铃的摆动", "被风掀起的纸角", "门口的光尘"],
        "avoid": ["用字幕报时", "门自己无声滑开", "光效乱闪"]
      },
      {
        "order": 6,
        "timeLock": "soft",
        "target": "第六句到收尾",
        "what": "他把第一杯放在窗边，像每天一样，没有说话。",
        "visual": "窗边的台面先空着；焦点轻轻一虚，杯子已经放稳在窗边，蒸汽在窗光里升起来；没有人说话。",
        "mustAchieve": "观众看见第一杯被放到窗边，并且感到这是一件每天都做的事。",
        "mayUse": ["袖子的一角", "杯底接触台面的轻碰", "窗外经过的自行车"],
        "avoid": ["露出正脸", "煽情的慢动作", "用旁白解释"]
      }
    ],
    "tone": "安静、克制、有生活的手感；像清晨第一杯咖啡之前的几分钟，不煽情，也不做成广告。",
    "copy": [
      {
        "id": "title",
        "text": "七点零五分",
        "role": "title",
        "at": 0.8,
        "until": 4.6,
        "atSource": "estimate",
        "timeLock": "soft"
      },
      {
        "id": "sub-1",
        "text": "七点，卷帘门只拉起一半，\n晨光先落进吧台。",
        "role": "subtitle",
        "at": 5.0,
        "until": 12.8,
        "atSource": "estimate",
        "timeLock": "soft"
      },
      {
        "id": "sub-2",
        "text": "磨豆机响了一声，\n像把整条街的安静磨碎。",
        "role": "subtitle",
        "at": 14.0,
        "until": 21.8,
        "atSource": "estimate",
        "timeLock": "soft"
      },
      {
        "id": "sub-3",
        "text": "热水穿过咖啡粉，\n杯壁一点点变深。",
        "role": "subtitle",
        "at": 23.0,
        "until": 31.8,
        "atSource": "estimate",
        "timeLock": "soft"
      },
      {
        "id": "sub-4",
        "text": "牛奶落下去，\n白色在褐色里卷成一朵花。",
        "role": "subtitle",
        "at": 33.0,
        "until": 42.8,
        "atSource": "estimate",
        "timeLock": "soft"
      },
      {
        "id": "sub-5",
        "text": "七点零五分，门被推开，\n风把光推到杯沿。",
        "role": "subtitle",
        "at": 44.0,
        "until": 52.8,
        "atSource": "estimate",
        "timeLock": "soft"
      },
      {
        "id": "sub-6",
        "text": "他把第一杯放在窗边，\n像每天一样，没有说话。",
        "role": "subtitle",
        "at": 54.0,
        "until": 62.4,
        "atSource": "estimate",
        "timeLock": "soft"
      }
    ],
    "milestones": [],
    "script": []
  },
  "visual": {
    "status": "ready",
    "visualProblem": "六行诗是同一空间里的先后事件，但文本本身没有风格；要解决的是让每件事在画面里真实发生，同时不把片子做成六张插图或六段互不相关的场景。",
    "mechanism": "一条吧台长卷：六个事件沿同一张吧台从左到右排开，横向移动把它们依次带进画面；晨光的角度和亮度当时间刻度。",
    "mechanismSource": "candidate",
    "selectedOption": "A",
    "camera": "平视、略低于人眼，沿吧台缓慢横移；每个事件在画面里停留，靠光和物件自己的动作推进，不靠字卡。",
    "cameraSource": "candidate",
    "palette": {
      "bg": "#DCD6C8",
      "fg": "#2E2620",
      "accent": "#C4603C",
      "cool": "#8FA3A6",
      "extra": ["#F4EEE2", "#C08B5C", "#8F5F3D", "#3A2015", "#FFE3B4"]
    },
    "antiPatterns": [
      "大字卡或居中标题轮播",
      "照片加推拉",
      "纯黑背景加暖光光球",
      "八个互不相关的场景拼贴",
      "字幕说门/磨豆机/人，画面里却没有",
      "拉花直接用贴图贴上去"
    ],
    "references": [
      {
        "type": "doc",
        "path": "Edward Hopper, Morning Sun (1952)",
        "what": "冷调室内加单侧硬光：光只落在一小块地方，其余留在阴影里"
      }
    ],
    "options": [
      {
        "id": "A",
        "mechanism": "吧台长卷加横向移动：同一空间里的六个事件按顺序入画",
        "camera": "平视横移，事件依次入画",
        "palette": {
          "bg": "#DCD6C8",
          "fg": "#2E2620",
          "accent": "#C4603C"
        },
        "styleFrame": "probe/f60.png"
      },
      {
        "id": "B",
        "mechanism": "光的主观视角：摄影机就是晨光，从门缝进入，掠过物件",
        "camera": "贴地穿行，低角度",
        "palette": {
          "bg": "#141310",
          "fg": "#F1E6D2",
          "accent": "#FFC27A"
        },
        "styleFrame": "未出图：光的主观视角，暗底加局部材质高光"
      },
      {
        "id": "C",
        "mechanism": "正俯视吧台长条，像一条时间轴",
        "camera": "正俯视，画面内横向滑动",
        "palette": {
          "bg": "#E6DFD2",
          "fg": "#3A2C22",
          "accent": "#B5644A"
        },
        "styleFrame": "未出图：正俯视长条，平面图形感"
      }
    ],
    "notes": "用户只给文本，没有视觉参考。三个方向都是候选；选 A 是因为六行诗是同一空间里的先后事件，长卷能同时保住空间连续性和每个物件的可读性。用户要求直接出片，本次由制作方代选方向；同一份 brief 下可以换 B 或 C 重做。",
    "typography": {
      "title": "思源宋体 400，84px，字距 0.16em",
      "body": "思源宋体 400，40px，行高 1.75，字距 0.06em",
      "subtitle": "左下，暖白 #F6EFE2，2px 陶土色引导线"
    },
    "textMode": "corner",
    "production": "procedural"
  },
  "audio": {
    "bpm": 48,
    "vo": false,
    "syncPoints": [],
    "musicSource": "无：用户只给字幕，没有音乐或旁白；成片为静默片，声音留给想象。"
  },
  "assumptions": [
    "用户只给六行诗，没有时长、画幅、音频；按 66 秒、16:9、30fps 处理。",
    "字幕按每秒 3.2 字加句间停顿估时，具体段长由 animatic 量出来。",
    "片名取自用户标题；七点与七点零五分是故事里的时间，不是视频时间码。",
    "全片不出现人物正脸；最后一拍只出现一只手，避免演员和素材依赖。",
    "最后一拍实际不出现手：手在 1.4 秒的轻虚焦里完成动作，这是验收第 5 条预授权的退路。"
  ],
  "openQuestions": [],
  "sources": [
    {
      "type": "prompt",
      "path": "input.md",
      "what": "用户给出的片名与六行诗"
    }
  ],
  "build": {
    "projectDir": "/home/lufering/remotion/electron",
    "entry": "remotion/index.ts",
    "compositionId": "SevenOhFive",
    "outPath": "out/seven-oh-five.mp4"
  },
  "creativeRoom": {
    "builderOwns": [
      "机位与运动",
      "镜头数量与切换",
      "转场",
      "构图",
      "光的走向与色温",
      "物件的具体造型",
      "每段的实际秒数"
    ],
    "mustSolve": [
      "六个事件都要在画面里真实发生，字幕只负责诗，不负责解释画面",
      "时间要能被看见：卷帘门的缝隙、光的角度、墙上的钟至少有两样在走",
      "静音观看也能按顺序读出店醒、磨豆、注水、拉花、门开、第一杯"
    ],
    "mayInvent": [
      "光里的尘埃",
      "磨豆机旁的粉痕",
      "窗外的自行车",
      "门口被风掀起的纸角",
      "吧台尽头的一只空杯"
    ],
    "notPrescribed": [
      "具体镜头数",
      "每段秒数",
      "转场方式",
      "是否连续移动"
    ],
    "rule": "brief 只给事实、顺序和验收；镜头、载体和节奏由制作层自己解决。"
  },
  "builderMandate": "用真实空间和物件承载六行诗：每一句都要在画面里发生，字幕只是诗，不是分镜说明。不要用大字卡、照片推拉或无关场景轮播填时间。",
  "timing": {
    "totalSec": 66,
    "totalSource": "estimate",
    "bpm": 48,
    "hardAnchors": [],
    "softTargets": [
      {
        "what": "六行字幕按诗的顺序出现，每句留出动作完成的时间",
        "order": "1 到 6",
        "spacing": "句间留 0.8 到 1.2 秒空白",
        "note": "具体秒数由 animatic 量出来"
      },
      {
        "what": "七点零五分的门开要晚于拉花完成",
        "order": "4 到 5",
        "note": "因果不能倒"
      }
    ],
    "owner": "Builder，在 G3 animatic 里量",
    "rule": "只锁总长 66 秒和六句的先后顺序；每句段长由 animatic 实测，不许用空镜或慢推填时间。"
  },
  "acceptance": [
    "静音观看也能按顺序读出：店刚醒、磨豆、注水、拉花、门开、第一杯放到窗边。",
    "每条字幕出现时，画面里真的发生它说的事：磨豆机、热水、牛奶、门、窗边和杯子都在画面里。",
    "七点零五分的门开和光被推到杯沿有先后因果，不是同时闪一下。",
    "没有黑帧、死帧、文字被主体压住或读不清。",
    "最后一拍的手看起来是人手，不是色块；如果做不到，就让手留在画外，只拍杯子和蒸汽。"
  ]
}
